Name,Brand,,Image URL,Price,MSRP,Units Available
Takota Dark Brown Rectangular Oak Wood w/ Birch Wood Legs Extendable Dining Table,Mercana,Furniture,https://res.cloudinary.com/dnmufldqz/image/upload/v1764632552/mercana-products/yj7qulxq2ty2eoho2fsm.jpg,"$1,440.00","$3,899",8
Soma Textured Black Acacia Wood Round Dining Table,Mercana,Furniture,https://res.cloudinary.com/dnmufldqz/image/upload/v1764632553/mercana-products/rxktnapde9ydslvpnlqj.jpg,$408.00,"$1,209",6
Tucson Natural Wood w/ Round Black Oak Top Side Table,Mercana,Furniture,https://res.cloudinary.com/dnmufldqz/image/upload/v1764632555/mercana-products/aarnyhfgajgx9fkn3xxg.jpg,$243.00,$549,6
Valence 3 Piece (W/ 2 x Ottoman) Castlerock Gray Modular Sofa Set,Mercana,Furniture,https://res.cloudinary.com/dnmufldqz/image/upload/v1764632557/mercana-products/tmjs2at2mdzkhxxmxzvu.jpg,$600.00,"$1,999",2
Rialto Rectangular Two-Tone Black and Brown Solid Wood Dining Table,Mercana,Furniture,https://res.cloudinary.com/dnmufldqz/image/upload/v1764632559/mercana-products/iuxmdu0kfgwkuoafqrca.jpg,$870.00,"$3,199",6
Tanner Marble & Gold Metal Bistro Table,Mercana,Furniture,https://res.cloudinary.com/dnmufldqz/image/upload/v1764632560/mercana-products/kekflpic2kmvuaarloqk.jpg,$406.80,"$1,509",18
Tanner Marble & Matte Black Bistro Table,Mercana,Furniture,https://res.cloudinary.com/dnmufldqz/image/upload/v1764632561/mercana-products/xi9woe3awyrode1qv5vv.jpg,$381.00,"$1,449",15
Athens 48.0L x 28.0W x 16.0H Light Brown Wood and White Marble Coffee Table,Mercana,Furniture,https://res.cloudinary.com/dnmufldqz/image/upload/v1764632562/mercana-products/emcqp2y69libggyhiost.jpg,$388.08,"$1,149",2
Svend 111.4L x 68.0W x 33.9H Tan Leather Left Chaise Sectional Sofa,Mercana,Furniture,https://res.cloudinary.com/dnmufldqz/image/upload/v1764632563/mercana-products/qxniecjm6437d9ayw7nj.jpg,"$3,044.88","$7,899",6
"D'Arcy 111""L x 70""D x 33""H Tan Leather Right Chaise Sectional",Mercana,Furniture,https://res.cloudinary.com/dnmufldqz/image/upload/v1764632564/mercana-products/hcysaurp9uegtja8zmdj.jpg,"$2,850.00","$7,599",13
Felicity 36.0L x 36.0W x 16.0H Marble Top W/Iron Frame Coffee Table,Mercana,Furniture,https://res.cloudinary.com/dnmufldqz/image/upload/v1764632566/mercana-products/rgierzoiupnnuryignve.jpg,$408.00,"$1,389",22
Lorlei 20.0L x 20.0W x 23.8H White Marble Top W/Antique Gold Iron Legs End and Side Table,Mercana,Furniture,https://res.cloudinary.com/dnmufldqz/image/upload/v1764632567/mercana-products/o1m5sg6a8ilqlubccxk8.jpg,$258.48,$849,14
"Jacinta 36"" Round Glass Top Metal and Marble Pedestal Coffee Table",Mercana,Furniture,https://res.cloudinary.com/dnmufldqz/image/upload/v1764632569/mercana-products/g4zfhg1hbgjbltb5abcn.jpg,$431.28,"$1,399",14
Shale III 50L x 20W Black Live-Edge Slate and Iron Console Table,Mercana,Furniture,https://res.cloudinary.com/dnmufldqz/image/upload/v1764632571/mercana-products/bfdfaco2mfep0vdiqpps.jpg,$366.48,"$1,169",3
"Tanner II 48"" Round White Marble Top Black Metal Base Dining Table",Mercana,Furniture,https://res.cloudinary.com/dnmufldqz/image/upload/v1764632573/mercana-products/delzg0qgdu3cz8dxmsjd.jpg,$435.00,"$1,349",19
Tanner I 71L x 35W Rectangular White Marble W/ Metal Base Dining Table,Mercana,Furniture,https://res.cloudinary.com/dnmufldqz/image/upload/v1764632574/mercana-products/cikv3wbb8sbvcwwkdorl.jpg,$575.28,"$1,769",8
"Nathan 36""x36"" Square White Marble Top Black Metal Base Coffee Table",Mercana,Furniture,https://res.cloudinary.com/dnmufldqz/image/upload/v1764632575/mercana-products/kqqavcneb1d7anqr72ii.jpg,$345.00,"$1,069",2
"Nathan II 18"" x 20"" Square Top White Marble and Black Metal End/Side Table",Mercana,Furniture,https://res.cloudinary.com/dnmufldqz/image/upload/v1764632577/mercana-products/xlzcpt9rvwqwr4jzxesu.jpg,$143.28,$449,18
Papillion I 66L x 16W Blonde Wood and Iron Console Table,Mercana,Furniture,https://res.cloudinary.com/dnmufldqz/image/upload/v1764632578/mercana-products/qhq9yhq6psv9lf6xbhcm.jpg,$316.08,$869,6
Reinhold IV 59L x 16W White Marble Top Gold Metal Base Console Table,Mercana,Furniture,https://res.cloudinary.com/dnmufldqz/image/upload/v1764632580/mercana-products/cb6jqgag8zfzga3632nk.jpg,$539.28,"$1,669",11
Papillion II 80x40 Rectangular Blonde Live Edge Sold Wood Top Black Metal Base Dining Table,Mercana,Furniture,https://res.cloudinary.com/dnmufldqz/image/upload/v1764632581/mercana-products/b913s1xysoiiwh6pijib.jpg,$532.08,"$1,709",6
"Denali IV 121"" Beige Upholstered Wooden Frame Left Four Seater Sectional",Mercana,Furniture,https://res.cloudinary.com/dnmufldqz/image/upload/v1764632582/mercana-products/pzi2sv4bjztqxzcn9jls.jpg,"$2,010.00","$5,599",6
Denali III Beige Upholstered Wooden Frame Sectional,Mercana,Furniture,https://res.cloudinary.com/dnmufldqz/image/upload/v1764632584/mercana-products/xdyz7xpbskfrerzu1ezi.jpg,"$1,964.88","$5,599",8
Papillion III 66x18 Natural Solid Wood and Iron Dining Bench,Mercana,Furniture,https://res.cloudinary.com/dnmufldqz/image/upload/v1764632585/mercana-products/bvl5ds5qqpl0hyprxqse.jpg,$285.00,$799,20
Pinera III 49L x 17W Black Slate W/Iron Base Console Table,Mercana,Furniture,https://res.cloudinary.com/dnmufldqz/image/upload/v1764632587/mercana-products/cjtzqtqhkqakzuqzav7l.jpg,$359.28,"$1,209",1
Papillion II 84.0L x 38.0W x 30.0H Rectangular Natural Wood Top W/Black Iron Base Dining Table,Mercana,Furniture,https://res.cloudinary.com/dnmufldqz/image/upload/v1764632588/mercana-products/xnfwbhber7juqwkpy0su.jpg,$546.48,"$1,729",10
Cheers Dark Brown Solid Wood Wine Bottle Storage Kitchen Island,Mercana,Furniture,https://res.cloudinary.com/dnmufldqz/image/upload/v1764632589/mercana-products/c24nc4d4gpnduwqw2bzg.jpg,"$1,050.00","$3,099",9
Brodie VI 57L x 20.5W x 94H Light Brown Wood Nickle Ladder Four Shelf Shelving Unit,Mercana,Furniture,https://res.cloudinary.com/dnmufldqz/image/upload/v1764632591/mercana-products/ai7zxqxy77ew7tb4vkhc.jpg,"$1,043.28","$2,999",5
Brodie III 32L x 22W x 94H Medium Brown Wood Silver Accent Four Shelf Shelving Unit,Mercana,Furniture,https://res.cloudinary.com/dnmufldqz/image/upload/v1764632592/mercana-products/orwssfy6zr6oi9rosose.jpg,$719.28,"$2,099",4
Sunnyvale 32L x 18W x 90H Dark Brown Solid Wood and Mirrored Glass Four Shelf Shelving Unit,Mercana,Furniture,https://res.cloudinary.com/dnmufldqz/image/upload/v1764632593/mercana-products/bzv3i4uj2z00ocnmdmd7.jpg,$748.08,"$1,549",7
Braxton Light Brown Solid Wood w/ Gunmetal Knobs Accent Cabinet 1 Drawer 2 Doors,Mercana,Furniture,https://res.cloudinary.com/dnmufldqz/image/upload/v1764632594/mercana-products/cq829v0v9uyeykknxkfv.jpg,$417.00,"$1,329",36
Braxton Light Brown Solid Wood w/ Antiqued Brass Knobs 3 Drawer 6 Door Sideboard,Mercana,Furniture,https://res.cloudinary.com/dnmufldqz/image/upload/v1764632596/mercana-products/nekxmf9yq8x9ejc3hzwk.jpg,"$1,020.00","$3,299",1
Wayde Curio Cabinet Recycled Pine,Mercana,Furniture,https://res.cloudinary.com/dnmufldqz/image/upload/v1764632597/mercana-products/qb2oanrgmqp8p1qvonu0.jpg,$870.00,"$2,199",9
Wolcott Rectangular Dark Brown Solid Wood Bench,Mercana,Furniture,https://res.cloudinary.com/dnmufldqz/image/upload/v1764632599/mercana-products/pg9su8ntl0lfh8kuqe5p.jpg,$207.00,$649,10
Haggen Light Brown Oak Wood w/ Cream Fabric Accent Chair,Mercana,Furniture,https://res.cloudinary.com/dnmufldqz/image/upload/v1764632600/mercana-products/qapryfgjkbajeyd61gpp.jpg,$528.00,"$1,399",8
Casey Matte Black Metal w/ Gray Fabric Dining Chair,Mercana,Furniture,https://res.cloudinary.com/dnmufldqz/image/upload/v1764632601/mercana-products/lnne0slbuaywvbcgfjmh.jpg,$157.68,$489,2
Varenna 4 Door Dark Brown Wood w/ Rope Handles Sideboard,Mercana,Furniture,https://res.cloudinary.com/dnmufldqz/image/upload/v1764632602/mercana-products/kq86lr7n2kwzuahdgjsu.jpg,"$1,080.00","$2,999",5
Ummi Tall Off White w/ Gray-Brown Antiquing Ceramic Floor Vase,Mercana,Decor,https://res.cloudinary.com/dnmufldqz/image/upload/v1764632604/mercana-products/beg7kcub5uueftsddxhq.jpg,$165.00,$409,24
Ummi Small Off White w/ Gray-Brown Antiquing Ceramic Floor Vase,Mercana,Decor,https://res.cloudinary.com/dnmufldqz/image/upload/v1764632605/mercana-products/ykflvnp13utnra0e2oh7.jpg,$102.00,$239,24
Velia Tall Seashell Sculptural Cream Glazed Ceramic Vase,Mercana,Decor,https://res.cloudinary.com/dnmufldqz/image/upload/v1764632606/mercana-products/kpl4kazkzffbfuhjrann.jpg,$123.00,$329,35
Velia Short Seashell Sculptural Cream Glazed Ceramic Vase,Mercana,Decor,https://res.cloudinary.com/dnmufldqz/image/upload/v1764632608/mercana-products/jo2kedrslsfx9rhonswh.jpg,$57.00,$149,36
Urvi Tall Off White Speckled Asymmetrical Ceramic Vase,Mercana,Decor,https://res.cloudinary.com/dnmufldqz/image/upload/v1764632609/mercana-products/h6kutauairsj9syjrfhv.jpg,$33.00,$79,57
Vahn Sculptural Cream Glazed Decorative Ceramic Bowl,Mercana,Decor,https://res.cloudinary.com/dnmufldqz/image/upload/v1764632610/mercana-products/gnclpyrxwbgqwczijvve.jpg,$72.00,$189,73
Twyla Tall Cream Glazed Floor Ceramic Vase,Mercana,Decor,https://res.cloudinary.com/dnmufldqz/image/upload/v1764632611/mercana-products/kfdgdbwmhgjgge5af9md.jpg,$135.00,$359,7
Twyla Short Cream Glazed Floor Vase,Mercana,Decor,https://res.cloudinary.com/dnmufldqz/image/upload/v1764632613/mercana-products/lrxhaizbrhpojwevucld.jpg,$84.00,$199,31
Truett White w/ Blue Stripes Ceramic Jug Vase,Mercana,Decor,https://res.cloudinary.com/dnmufldqz/image/upload/v1764632614/mercana-products/rimbwujtyuxkusfle7pn.jpg,$39.00,$99,37
Ulvi Cream Glazed Bubble Ceramic Vase,Mercana,Decor,https://res.cloudinary.com/dnmufldqz/image/upload/v1764632615/mercana-products/tmr5hvqemlregczbwyr4.jpg,$36.00,$89,19
Vanna Sculptural Cream Glazed Ceramic Vase,Mercana,Decor,https://res.cloudinary.com/dnmufldqz/image/upload/v1764632617/mercana-products/izursiwwwyp90pppbsvi.jpg,$63.00,$159,46
Dylan Tall Textured Off White w/ Handles Ceramic Vase,Mercana,Decor,https://res.cloudinary.com/dnmufldqz/image/upload/v1764632618/mercana-products/njnglgffwjzoucpp32p0.jpg,$45.00,$109,33
Dylan Small Textured Off White w/ Handles Ceramic Vase,Mercana,Decor,https://res.cloudinary.com/dnmufldqz/image/upload/v1764632620/mercana-products/hgkolbzpixldkdyzmmch.jpg,$27.00,$59,35
Mira Tall Textured Blush Beige Fluted Ceramic Vase,Mercana,Decor,https://res.cloudinary.com/dnmufldqz/image/upload/v1764632621/mercana-products/nia7dxpjqd1xscnt280f.jpg,$30.00,$79,44
Mira Wide Textured Blush Beige Fluted Ceramic Vase,Mercana,Decor,https://res.cloudinary.com/dnmufldqz/image/upload/v1764632622/mercana-products/uqelabma95917qdbghie.jpg,$51.00,$129,32
Darian Tall Textured Matte White Ceramic Vase,Mercana,Decor,https://res.cloudinary.com/dnmufldqz/image/upload/v1764632623/mercana-products/v2twxslgdm1ugneedbaf.jpg,$21.00,$46,7
Darian Small Textured Matte White Ceramic Vase,Mercana,Decor,https://res.cloudinary.com/dnmufldqz/image/upload/v1764632625/mercana-products/jmuvuzvtulhnpaafe5dv.jpg,$12.00,$29,19
Dinah Large White w/ Black Stripes Ceramic Vase,Mercana,Decor,https://res.cloudinary.com/dnmufldqz/image/upload/v1764632626/mercana-products/viomfsa6jptqbb4uevgq.jpg,$66.00,$169,35
Dinah Small White w/ Black Stripes Ceramic Vase,Mercana,Decor,https://res.cloudinary.com/dnmufldqz/image/upload/v1764632627/mercana-products/ncrxhvcah9vpoodczawu.jpg,$45.00,$109,40
Townley Tall White w/ Black Ombre Metal Vase,Mercana,Decor,https://res.cloudinary.com/dnmufldqz/image/upload/v1764632628/mercana-products/tayld3pbz0pbtoiigzjx.jpg,$27.00,$59,5
Townley Small White w/ Black Ombre Metal Vase,Mercana,Decor,https://res.cloudinary.com/dnmufldqz/image/upload/v1764632630/mercana-products/i9qr3vpd4vqopgrodbzz.jpg,$24.00,$59,9
Tovah Tall Textured White w/ Gold Metal Vase,Mercana,Decor,https://res.cloudinary.com/dnmufldqz/image/upload/v1764632631/mercana-products/tztbci2gkvbdu8hx01uu.jpg,$27.00,$59,33
Tovah Medium Textured White w/ Gold Metal Vase,Mercana,Decor,https://res.cloudinary.com/dnmufldqz/image/upload/v1764632633/mercana-products/a0wklhrlbgpilfhxzqzu.jpg,$24.00,$59,26
Tovah Small Textured White w/ Gold Metal Vase,Mercana,Decor,https://res.cloudinary.com/dnmufldqz/image/upload/v1764632634/mercana-products/xgbfiqswexlkjurirgmv.jpg,$21.00,$49,39
Troian Large Rattan Wrapped Glass Bottle,Mercana,Decor,https://res.cloudinary.com/dnmufldqz/image/upload/v1764632635/mercana-products/qwiywyyksvv4am1ks7h1.jpg,$57.00,$159,10
Troian Medium Rattan Wrapped Glass Bottle,Mercana,Decor,https://res.cloudinary.com/dnmufldqz/image/upload/v1764632637/mercana-products/z0ft0iyrj0ngxas5ikkx.jpg,$30.00,$89,7
Thad 1-Light Natural Woven Rattan Dome Pendant,Mercana,Lighting,https://res.cloudinary.com/dnmufldqz/image/upload/v1764632638/mercana-products/zafljfvechwdvi4uqcul.jpg,$147.00,$449,21
Titus 1-Light Brass Finished Metal Disc Pendant,Mercana,Lighting,https://res.cloudinary.com/dnmufldqz/image/upload/v1764632639/mercana-products/nzlxgcfr3gkfgyicznnc.jpg,$132.00,$439,28
Tori Textured Gold Metal Cross Frame Wall Mirror,Mercana,Decor,https://res.cloudinary.com/dnmufldqz/image/upload/v1764632641/mercana-products/jkqmqyfwb8rtapqlhhab.jpg,$243.00,$639,18
Tori Gunmetal w/ Textured Metal Cross Frame Wall Mirror,Mercana,Decor,https://res.cloudinary.com/dnmufldqz/image/upload/v1764632643/mercana-products/nlntjqibnvdpmawdseah.jpg,$240.00,$639,8
Tiffany Brushed Gold Double Frame Metal Arched Mirror,Mercana,Decor,https://res.cloudinary.com/dnmufldqz/image/upload/v1764632644/mercana-products/kw66glrywrlpv4ozxlf9.jpg,$147.00,$379,7
Tillie Oblong Matte Black Metal Standing Floor Mirror,Mercana,Decor,https://res.cloudinary.com/dnmufldqz/image/upload/v1764632645/mercana-products/tohyrufpjkwf4ywje1zq.jpg,$234.00,$609,25
Tiffany Brushed Black Metal Double Frame Arched Mirror,Mercana,Decor,https://res.cloudinary.com/dnmufldqz/image/upload/v1764632646/mercana-products/uojc8v3caf4t9fgkdkrz.jpg,$147.00,$379,8
Tiva Rectangular Dual Brushed Gold Metal Framed Mirror,Mercana,Decor,https://res.cloudinary.com/dnmufldqz/image/upload/v1764632648/mercana-products/uplw1jihzznakk6zakk5.jpg,$147.00,$359,39
Stratton Gunmetal w/ Genuine Aged Black Leather Upholstered Accent Chair,Mercana,Furniture,https://res.cloudinary.com/dnmufldqz/image/upload/v1764632650/mercana-products/eyxdurd6crdirzsykits.jpg,$690.00,"$1,999",10
"Teva Black Wood Rectangular 92"" Dining Table",Mercana,Furniture,https://res.cloudinary.com/dnmufldqz/image/upload/v1764632651/mercana-products/tnxzibcm7gfcjmv77ppn.jpg,"$1,170.00","$2,899",6
Taylin Light Brown Wood Round Coffee Table,Mercana,Furniture,https://res.cloudinary.com/dnmufldqz/image/upload/v1764632653/mercana-products/eat6jvj0pp2ocgyylw6c.jpg,$561.00,"$1,359",6
"Jennings 60"" Light Brown Wood Dining Table",Mercana,Furniture,https://res.cloudinary.com/dnmufldqz/image/upload/v1764632655/mercana-products/xapfmrxnhf1wrfm9lzwt.jpg,$504.00,"$1,559",8
Taimo White Washed Light Brown Wood w/ Striped Fabric Seat Bench,Mercana,Furniture,https://res.cloudinary.com/dnmufldqz/image/upload/v1764632657/mercana-products/oiluhejvcrxlpzx3x2ld.jpg,$210.00,$639,9
Tadi Rectangular Dark Brown Wood w/ Rug Seat Bench,Mercana,Furniture,https://res.cloudinary.com/dnmufldqz/image/upload/v1764632659/mercana-products/iuaz4yvptv4toyls7uxh.jpg,$288.00,$959,5
Taniel Textured Black Wood w/ Black Metal Stool,Mercana,Furniture,https://res.cloudinary.com/dnmufldqz/image/upload/v1764632660/mercana-products/ziyckfxwzzml9jt1jbwh.jpg,$108.00,$319,22
Taniel Light Brown Wood w/ Black Metal Stool,Mercana,Furniture,https://res.cloudinary.com/dnmufldqz/image/upload/v1764632661/mercana-products/e03mswwatnnbtjneivr3.jpg,$108.00,$319,8
Sina Brown Oak Wood w/ Natural Rattan 2 Door Curio Cabinet,Mercana,Furniture,https://res.cloudinary.com/dnmufldqz/image/upload/v1764632663/mercana-products/ixe1p9dyttkto6ad8w3s.jpg,"$1,320.00","$3,499",7
Shane Black Wood w/ Woven Black Leather Bench,Mercana,Furniture,https://res.cloudinary.com/dnmufldqz/image/upload/v1764632664/mercana-products/jpv4bgaodwlha4ztrrwq.jpg,$453.00,"$1,409",7
Shane Brown Wood w/ Woven Brown Leather Bench,Mercana,Furniture,https://res.cloudinary.com/dnmufldqz/image/upload/v1764632665/mercana-products/bojznonixfqbzecjvchs.jpg,$453.00,"$1,409",7
Shane Brown Wood w/ Woven Brown Leather Counter Stool,Mercana,Furniture,https://res.cloudinary.com/dnmufldqz/image/upload/v1764632667/mercana-products/dky6p39c2zuan02kdf5d.jpg,$333.00,"$1,069",18
Sekou Light Brown Wooden Craftsman Console Table,Mercana,Furniture,https://res.cloudinary.com/dnmufldqz/image/upload/v1764632668/mercana-products/pj6e2rxztvoaafotz9gj.jpg,$241.20,$699,3
Sekou Light Brown Short Wooden Craftsman Stool,Mercana,Furniture,https://res.cloudinary.com/dnmufldqz/image/upload/v1764632669/mercana-products/cis5fh9wlqg244hnd9r0.jpg,$107.28,$329,4
Parker Muted Brown Faux Leather w/ Black Metal Counter Stool,Mercana,Furniture,https://res.cloudinary.com/dnmufldqz/image/upload/v1764632671/mercana-products/d1qf2ccaom2jdljhpbmn.jpg,$222.48,$639,16
Samiya Jute w/ White Cotton Pouf,Mercana,Decor,https://res.cloudinary.com/dnmufldqz/image/upload/v1764632673/mercana-products/konouk31firu3nmxfwre.jpg,$67.68,$229,9
Sadiyah Antiqued Gold Brushed Metal w/ Cream Shade Table Lamp,Mercana,Lighting,https://res.cloudinary.com/dnmufldqz/image/upload/v1764632675/mercana-products/qfhzn37i78kmn3phkkqw.jpg,$123.00,$379,17
Riri Wooden Bird Decorative Object,Mercana,Furniture,https://res.cloudinary.com/dnmufldqz/image/upload/v1764632676/mercana-products/xztq5qzu0jgfmh28udex.jpg,$24.00,$69,66
Nora Charcoal Fabric w/ Matte Black Metal Legs Accent Chair,Mercana,Decor,https://res.cloudinary.com/dnmufldqz/image/upload/v1764632678/mercana-products/y1dyve9mydoj3zobx8gl.jpg,$280.08,$799,27
Rollins Large Cream w/ Black Stripes Wool Framed Art,Mercana,Decor,https://res.cloudinary.com/dnmufldqz/image/upload/v1764632679/mercana-products/avaqjw6dqd60hx8wowiw.jpg,$337.68,"$1,039",20
Rollins Small Cream w/ Black Stripes Wool Framed Art,Mercana,Decor,https://res.cloudinary.com/dnmufldqz/image/upload/v1764632680/mercana-products/yuxumfd6mh26ff9iasom.jpg,$190.80,$579,18
Revelin Large Fabric Collage Framed Linen Framed Wall Art,Mercana,Decor,https://res.cloudinary.com/dnmufldqz/image/upload/v1764632682/mercana-products/hyivejmgtvvcphcwmutm.jpg,$272.88,$809,24
Revelin Small Fabric Collage Framed Linen Wall Art,Mercana,Lighting,https://res.cloudinary.com/dnmufldqz/image/upload/v1764632684/mercana-products/huvzg6y0qmah9odelm4m.jpg,$183.60,$559,21
Gabriel Large Matte Black Chandelier,Mercana,Furniture,https://res.cloudinary.com/dnmufldqz/image/upload/v1764632685/mercana-products/bthhvi3g0gcudpj9gtau.jpg,$222.48,$559,10
Nora Forest Green Fabric w/ Matte Black Metal Legs Accent Chair,Mercana,Furniture,https://res.cloudinary.com/dnmufldqz/image/upload/v1764632686/mercana-products/damfomrzss5l0cxexzgo.jpg,$280.08,$799,26
Nora Cream Fabric w/ Matte Black Metal Legs Accent Chair,Mercana,Furniture,https://res.cloudinary.com/dnmufldqz/image/upload/v1764632688/mercana-products/cnl637nzpy9e70tsgujl.jpg,$280.08,$809,15
Grosjean Black Leather w/ Black Metal Frame Accent Chair,Mercana,Decor,https://res.cloudinary.com/dnmufldqz/image/upload/v1764632689/mercana-products/epnm8eiytcwfporaf5p6.jpg,$870.00,"$2,299",8
Pia Matte Black w/ Brushed Gold Metal Taper Candleholder (Set of 2),Mercana,Decor,https://res.cloudinary.com/dnmufldqz/image/upload/v1764632690/mercana-products/ndba1ve6pyt4s04bnzti.jpg,$30.00,$79,62
Quade Small Gold Metal Planter,Mercana,Decor,https://res.cloudinary.com/dnmufldqz/image/upload/v1764632691/mercana-products/p2x8sphgw1riuz7t4gzx.jpg,$30.00,$89,17
Piero Large Concrete Finished Metal Decorative Bowl,Mercana,Decor,https://res.cloudinary.com/dnmufldqz/image/upload/v1764632693/mercana-products/idb9c1nypta8kkil7fel.jpg,$73.44,$219,29
Piero Small Concrete Finished Metal Decorative Bowl,Mercana,Decor,https://res.cloudinary.com/dnmufldqz/image/upload/v1764632694/mercana-products/ypntbkprnlad5ihs1oja.jpg,$54.00,$159,16
Heera Light Brown Diamond Motif w/ Shelf Accent Cabinet,Mercana,Furniture,https://res.cloudinary.com/dnmufldqz/image/upload/v1764632695/mercana-products/oc9lygvtipfhil6nshty.jpg,$435.00,"$1,249",26
Celeste Dark Brown Medium Arched Mirror,Mercana,Decor,https://res.cloudinary.com/dnmufldqz/image/upload/v1764632698/mercana-products/tsfsnh7aobfjmtdpcgw2.jpg,$207.00,$609,31
Randy Textured Silver Nickel Cast Aluminum Metal Accent Table,Mercana,Furniture,https://res.cloudinary.com/dnmufldqz/image/upload/v1764632699/mercana-products/zrupyfonkrokvv5dwwta.jpg,$140.40,$449,6
Raul Medium Brown Wood W/ Silver Metal Wall Clock,Mercana,Decor,https://res.cloudinary.com/dnmufldqz/image/upload/v1764632701/mercana-products/jp9p6p3zvgfnjjw7kszk.jpg,$102.00,$309,11
Ranela Light Brown Beaded Wooden Wall Mirror,Mercana,Decor,https://res.cloudinary.com/dnmufldqz/image/upload/v1764632703/mercana-products/nv6zoa5zqtdjqa5qc7yv.jpg,$135.00,$379,77
Rios Gold and Red Painted w/ Acid Wash Metal Wall Art,Mercana,Decor,https://res.cloudinary.com/dnmufldqz/image/upload/v1764632704/mercana-products/hcllikxkpseaxh7kuevv.jpg,$234.00,$659,12
Ramos Painted Antiqued Gold Metal Wall Art,Mercana,Decor,https://res.cloudinary.com/dnmufldqz/image/upload/v1764632706/mercana-products/oasnsrvxgvwmtjqkh1jf.jpg,$108.00,$329,21
Clapp Round Light Brown W/ White Wash Wood and Silver Metal Nesting Coffee Tables (Set of 2),Mercana,Furniture,https://res.cloudinary.com/dnmufldqz/image/upload/v1764632707/mercana-products/xvxgxbuzitd1i2zndcgj.jpg,$408.00,"$1,229",5
Quonset Extra Tall Brass Finished Aluminum Metal Pillar Object,Mercana,Decor,https://res.cloudinary.com/dnmufldqz/image/upload/v1764632709/mercana-products/uv3rhqty1jwruf1huojr.jpg,$64.08,$189,67
Sam Counter Stool W/ Light Brown Wood Frame and Beige Upholstered Seat,Mercana,Furniture,https://res.cloudinary.com/dnmufldqz/image/upload/v1764632710/mercana-products/gyl4ecspfsrzqat3p1sy.jpg,$265.68,$689,20
Ernest Medium Brown Wood Bar Stool,Mercana,Furniture,https://res.cloudinary.com/dnmufldqz/image/upload/v1764632712/mercana-products/sqmneflrytkgft5iyq7e.jpg,$154.76,$459,17
Etienne Light Brown Wood w/ Iron Metal Counter Stool,Mercana,Furniture,https://res.cloudinary.com/dnmufldqz/image/upload/v1764632714/mercana-products/zvrb6vrjfkxento1upgs.jpg,$172.08,$549,30
Indie Medium Brown Wood w/ Cane Bar Stool,Mercana,Furniture,https://res.cloudinary.com/dnmufldqz/image/upload/v1764632715/mercana-products/dlsyz6xeqx8zuvaeupol.jpg,$342.00,$949,13
Gianna Open Back Light Brown Wood w/ Oatmeal Fabric Accent Chair,Mercana,Furniture,https://res.cloudinary.com/dnmufldqz/image/upload/v1764632716/mercana-products/xl3xchakwjyysgwyuvdt.jpg,$600.00,"$1,599",12
Medina Antiqued Black Tall Metal Planters (Set of 2),Mercana,Decor,https://res.cloudinary.com/dnmufldqz/image/upload/v1764632718/mercana-products/myanqq3shnbteanthud4.jpg,$60.48,$149,9
Medina Antiqued Black Metal Planters (Set of 2),Mercana,Decor,https://res.cloudinary.com/dnmufldqz/image/upload/v1764632719/mercana-products/jwl4qgmd3tmnu41jbutu.jpg,$60.48,$149,26
Medina Off White w/ Gold Antiquing Metal Planters (Set of 2),Mercana,Decor,https://res.cloudinary.com/dnmufldqz/image/upload/v1764632721/mercana-products/nhcck5b1jugj5mpe1zzq.jpg,$60.48,$149,23
Tamuz Grass Baskets (Set of 2),Mercana,Decor,https://res.cloudinary.com/dnmufldqz/image/upload/v1764632722/mercana-products/eutm80kdbtjrfc2cvzxj.jpg,$45.00,$119,27
Thala Medium Brown Round Wicker Tray (Set of 2),Mercana,Decor,https://res.cloudinary.com/dnmufldqz/image/upload/v1764632724/mercana-products/omhjy4nvblwlocj4bp8g.jpg,$69.00,$169,9
Vivian Gold Metal and Glass Hurricane Candle Holder (Set of 2),Mercana,Decor,https://res.cloudinary.com/dnmufldqz/image/upload/v1764632725/mercana-products/mxthfvo1x4jmdf7pqh3u.jpg,$39.00,$99,17
Verna Matte Black Wire Cage Metal Planters (Set of 2),Mercana,Decor,https://res.cloudinary.com/dnmufldqz/image/upload/v1764632727/mercana-products/kmeg41qznsvc9qje2yvu.jpg,$103.68,$289,22
Ziva Large Distressed White Metal Sculptural Object,Mercana,Decor,https://res.cloudinary.com/dnmufldqz/image/upload/v1764632728/mercana-products/a8tzhirblv56eyfdaplj.jpg,$24.00,$49,18
Ziva Small Distressed Wall White Metal Sculptural Object,Mercana,Decor,https://res.cloudinary.com/dnmufldqz/image/upload/v1764632729/mercana-products/upixxmwijveu5hpozymo.jpg,$18.00,$43,19
Locke Large Gold Metal Decorative Object,Mercana,Decor,https://res.cloudinary.com/dnmufldqz/image/upload/v1764632731/mercana-products/tq2g9u2rytypwba6chbn.jpg,$10.08,$24,70
Locke Small Matte Gold Metal Decorative Object,Mercana,Decor,https://res.cloudinary.com/dnmufldqz/image/upload/v1764632732/mercana-products/dyezsxtvwtiapzzpjfqe.jpg,$8.64,$19,78
Locke Large Matte Black Metal Decorative Object,Mercana,Decor,https://res.cloudinary.com/dnmufldqz/image/upload/v1764632733/mercana-products/w5uexlwf59iay7x8cr7l.jpg,$10.08,$24,15
Irina Large White Marble Door Stopper,Mercana,Decor,https://res.cloudinary.com/dnmufldqz/image/upload/v1764632735/mercana-products/lhy8qjzffqlite45zeab.jpg,$49.68,$149,17
Wilton Brown Wood w/ 12 Black Metal Drawers Coffee Table,Mercana,Furniture,https://res.cloudinary.com/dnmufldqz/image/upload/v1764632736/mercana-products/y9suy1h6rgg3l1qh68a8.jpg,$316.08,"$1,069",4
Halston Corner Sectional Piece Oatmeal Performance Fabric,Mercana,Furniture,https://res.cloudinary.com/dnmufldqz/image/upload/v1764632738/mercana-products/mpzdq9vv4fz6vkietbfl.jpg,$561.00,"$1,559",5
Halston Right Arm Sectional Piece Oatmeal Performance Fabric,Mercana,Furniture,https://res.cloudinary.com/dnmufldqz/image/upload/v1764632739/mercana-products/p3o6egufplnk293qn5gm.jpg,$504.00,"$1,409",1
Britton Gold Metal w/ Clear Glass Globe 1-Light Wall Sconce,Mercana,Lighting,https://res.cloudinary.com/dnmufldqz/image/upload/v1764632741/mercana-products/qm3omz0ojxizjhdihkba.jpg,$89.99,$229,9
