Name,Brand,,Image URL,Price,MSRP,Units Available
Mitchell Black Metal Pedestal Base with Brown Wood Top Dining Table 63.0L x 63.0W x 30.0H,Mercana,Furniture,https://res.cloudinary.com/dnmufldqz/image/upload/v1764633710/mercana-products/scxozkh5cesgh4tp3qkn.jpg,"$1,007.28","$3,899",7
Elton 111.4L x 68.1W x 34.3H Tan Leather Right Chaise Sectional,Mercana,Furniture,https://res.cloudinary.com/dnmufldqz/image/upload/v1764633711/mercana-products/uovc2wifj7qbodiqsd0u.jpg,"$3,203.28","$8,299",7
Svend 111.4L x 68.0W x 33.9H Tan Leather Left Chaise Sectional Sofa,Mercana,Furniture,https://res.cloudinary.com/dnmufldqz/image/upload/v1764633713/mercana-products/q87cngraketdhybofd51.jpg,"$3,044.88","$7,899",4
"D'Arcy 111""L x 70""D x 33""H Tan Leather Left Chaise Sectional",Mercana,Furniture,https://res.cloudinary.com/dnmufldqz/image/upload/v1764633715/mercana-products/xc6p9hvrwfjyfj2ww8mr.jpg,"$2,828.88","$7,599",2
"D'Arcy 111""L x 70""D x 33""H Tan Leather Right Chaise Sectional",Mercana,Furniture,https://res.cloudinary.com/dnmufldqz/image/upload/v1764633716/mercana-products/gmfxaaxuo0bs8yy0bzyf.jpg,"$2,850.00","$7,599",8
Valence 3 Piece (W/ 2 x Ottoman) Medium Gray Modular Sofa Set,Mercana,Furniture,https://res.cloudinary.com/dnmufldqz/image/upload/v1764633718/mercana-products/os7p8opr05glaxhxm6ah.jpg,$780.00,"$2,599",3
Lorlei 20.0L x 20.0W x 23.8H White Marble Top W/Antique Gold Iron Legs End and Side Table,Mercana,Furniture,https://res.cloudinary.com/dnmufldqz/image/upload/v1764633719/mercana-products/h8xhnv99ejwao6hqluww.jpg,$258.48,$849,4
"Jacinta 36"" Round Glass Top Metal and Marble Pedestal Coffee Table",Mercana,Furniture,https://res.cloudinary.com/dnmufldqz/image/upload/v1764633720/mercana-products/j2ibdv2jujjohh5ssfa4.jpg,$431.28,"$1,399",18
Shale III 50L x 20W Black Live-Edge Slate and Iron Console Table,Mercana,Furniture,https://res.cloudinary.com/dnmufldqz/image/upload/v1764633722/mercana-products/fgnex3gmmhxilo7ep6d4.jpg,$366.48,"$1,169",20
"Tanner II 48"" Round White Marble Top Black Metal Base Dining Table",Mercana,Furniture,https://res.cloudinary.com/dnmufldqz/image/upload/v1764633723/mercana-products/cxaofbd4wgzvzixmwymd.jpg,$435.00,"$1,349",47
Tanner I 71L x 35W Rectangular White Marble W/ Metal Base Dining Table,Mercana,Furniture,https://res.cloudinary.com/dnmufldqz/image/upload/v1764633724/mercana-products/bmat4aee7llz7ydtnngs.jpg,$575.28,"$1,769",22
"Nathan II 18"" x 20"" Square Top White Marble and Black Metal End/Side Table",Mercana,Furniture,https://res.cloudinary.com/dnmufldqz/image/upload/v1764633726/mercana-products/gd1zodrfaax3focieghi.jpg,$143.28,$449,32
"Nathan 36""x36"" Square White Marble Top Black Metal Base Coffee Table",Mercana,Furniture,https://res.cloudinary.com/dnmufldqz/image/upload/v1764633727/mercana-products/dv26axrvqvo7sflubemj.jpg,$345.00,"$1,069",1
Papillion I 66L x 16W Blonde Wood and Iron Console Table,Mercana,Furniture,https://res.cloudinary.com/dnmufldqz/image/upload/v1764633729/mercana-products/zlqpurpwzrrrmb1hkxal.jpg,$316.08,$869,5
Papillion II 80x40 Rectangular Blonde Live Edge Sold Wood Top Black Metal Base Dining Table,Mercana,Furniture,https://res.cloudinary.com/dnmufldqz/image/upload/v1764633730/mercana-products/igwu7mwhjbu1rprecdav.jpg,$532.08,"$1,709",3
"Pinera 37"" Irregular White Marble Top Gold Metal Base Coffee Table",Mercana,Furniture,https://res.cloudinary.com/dnmufldqz/image/upload/v1764633732/mercana-products/so1uncpqgeziipg4zjui.jpg,$243.00,$799,2
"Denali IV 121"" Beige Upholstered Wooden Frame Left Four Seater Sectional",Mercana,Furniture,https://res.cloudinary.com/dnmufldqz/image/upload/v1764633734/mercana-products/jhmhkwopvfe2hquzw20w.jpg,"$2,010.00","$5,599",13
Papillion IV 60L x 26W Natural Solid Wood and Live Edge Iron Office Desk,Mercana,Furniture,https://res.cloudinary.com/dnmufldqz/image/upload/v1764633735/mercana-products/qkp9cooeu2dmyysqmhqs.jpg,$351.00,"$1,049",8
Papillion III 66x18 Natural Solid Wood and Iron Dining Bench,Mercana,Furniture,https://res.cloudinary.com/dnmufldqz/image/upload/v1764633738/mercana-products/kpzwbpss7kst2yrsfy1n.jpg,$285.00,$799,7
Bradie I 40L x 12W x 79H Brown Wood and Metal Frame Six Shelf Shelving Unit,Mercana,Furniture,https://res.cloudinary.com/dnmufldqz/image/upload/v1764633741/mercana-products/ipxw31hjsw0skevp6zuk.jpg,$395.28,"$1,169",5
Pinera III 49L x 17W Black Slate W/Iron Base Console Table,Mercana,Furniture,https://res.cloudinary.com/dnmufldqz/image/upload/v1764633742/mercana-products/zhqqpbynhnhun1z5m27j.jpg,$359.28,"$1,209",3
Papillion II 84.0L x 38.0W x 30.0H Rectangular Natural Wood Top W/Black Iron Base Dining Table,Mercana,Furniture,https://res.cloudinary.com/dnmufldqz/image/upload/v1764633743/mercana-products/e5xkaeuxcvgm29wybbbh.jpg,$546.48,"$1,729",8
Cheers Dark Brown Solid Wood Wine Bottle Storage Kitchen Island,Mercana,Furniture,https://res.cloudinary.com/dnmufldqz/image/upload/v1764633745/mercana-products/mo6vm2q9zdxjarudtnxm.jpg,"$1,050.00","$3,099",6
Papillion I 66L x 16W Natural Solid Wood and Iron Console Table,Mercana,Furniture,https://res.cloudinary.com/dnmufldqz/image/upload/v1764633748/mercana-products/deljbtgqog2jtg9wpuo0.jpg,$395.28,"$1,209",13
Brodie V,Mercana,Furniture,https://res.cloudinary.com/dnmufldqz/image/upload/v1764633756/mercana-products/tacwgqjj70to8xt1rm0g.jpg,$719.28,"$2,099",2
Brodie VI 57L x 20.5W x 94H Light Brown Wood Nickle Ladder Four Shelf Shelving Unit,Mercana,Furniture,https://res.cloudinary.com/dnmufldqz/image/upload/v1764633758/mercana-products/tjk36leyzqxxmv2vx8yl.jpg,"$1,043.28","$2,999",3
Sunnyvale 32L x 18W x 90H Dark Brown Solid Wood and Mirrored Glass Four Shelf Shelving Unit,Mercana,Furniture,https://res.cloudinary.com/dnmufldqz/image/upload/v1764633759/mercana-products/djumoqusy89pufcjofms.jpg,$748.08,"$1,549",6
Brodie III 32L x 22W x 94H Medium Brown Wood Silver Accent Four Shelf Shelving Unit,Mercana,Furniture,https://res.cloudinary.com/dnmufldqz/image/upload/v1764633762/mercana-products/tyry4xxyqjjopm4nlpvw.jpg,$719.28,"$2,099",3
Braxton Light Brown Solid Wood w/ Antiqued Brass Knobs 3 Drawer 6 Door Sideboard,Mercana,Furniture,https://res.cloudinary.com/dnmufldqz/image/upload/v1764633764/mercana-products/wbe8fqoi8graorargvts.jpg,"$1,020.00","$3,299",19
Braxton Light Brown Solid Wood w/ Gunmetal Knobs Accent Cabinet 1 Drawer 2 Doors,Mercana,Furniture,https://res.cloudinary.com/dnmufldqz/image/upload/v1764633766/mercana-products/xh28sillpneoqgzcf9xa.jpg,$417.00,"$1,329",28
Wayde Curio Cabinet Recycled Pine,Mercana,Furniture,https://res.cloudinary.com/dnmufldqz/image/upload/v1764633767/mercana-products/gbsmppoawocdbdvwnibt.jpg,$870.00,"$2,199",10
Wolcott Rectangular Dark Brown Solid Wood Bench,Mercana,Furniture,https://res.cloudinary.com/dnmufldqz/image/upload/v1764633768/mercana-products/cq6cv5zmnwv13u4zhsx9.jpg,$207.00,$649,2
Vyra Dark Brown Wood w/ Cream Fabric Accent Chair,Mercana,Furniture,https://res.cloudinary.com/dnmufldqz/image/upload/v1764633769/mercana-products/dnlm4ipoepbfzsm4o13t.jpg,$351.00,$989,1
Haggen Light Brown Oak Wood w/ Cream Fabric Accent Chair,Mercana,Furniture,https://res.cloudinary.com/dnmufldqz/image/upload/v1764633772/mercana-products/m3dwwu7qrgb5oqjulvux.jpg,$528.00,"$1,399",10
Haggen Medium Brown Oak Wood w/ Cream Fabric Accent Chair,Mercana,Furniture,https://res.cloudinary.com/dnmufldqz/image/upload/v1764633774/mercana-products/kmlf8zmoxhaeqtiemmc6.jpg,$495.00,"$1,309",8
Casey Matte Black Metal w/ Gray Fabric Dining Chair,Mercana,Furniture,https://res.cloudinary.com/dnmufldqz/image/upload/v1764633776/mercana-products/cvqetz8sgsk0trxypami.jpg,$157.68,$489,30
Varenna 4 Door Dark Brown Wood w/ Rope Handles Sideboard,Mercana,Furniture,https://res.cloudinary.com/dnmufldqz/image/upload/v1764633778/mercana-products/ghbhjsqjbmzxitmqrhkh.jpg,"$1,080.00","$2,999",11
Ummi Tall Off White w/ Gray-Brown Antiquing Ceramic Floor Vase,Mercana,Decor,https://res.cloudinary.com/dnmufldqz/image/upload/v1764633783/mercana-products/edweyw9ifjyva2asdis5.jpg,$165.00,$409,25
Ummi Small Off White w/ Gray-Brown Antiquing Ceramic Floor Vase,Mercana,Decor,https://res.cloudinary.com/dnmufldqz/image/upload/v1764633785/mercana-products/vgqt6yih4ctsohbncb0o.jpg,$102.00,$239,25
Velia Tall Seashell Sculptural Cream Glazed Ceramic Vase,Mercana,Decor,https://res.cloudinary.com/dnmufldqz/image/upload/v1764633786/mercana-products/qzy4bnron9mzm7sxstto.jpg,$123.00,$329,106
Velia Short Seashell Sculptural Cream Glazed Ceramic Vase,Mercana,Decor,https://res.cloudinary.com/dnmufldqz/image/upload/v1764633788/mercana-products/kxuehwo7ry1z4e4kwym5.jpg,$57.00,$149,96
Urvi Tall Off White Speckled Asymmetrical Ceramic Vase,Mercana,Decor,https://res.cloudinary.com/dnmufldqz/image/upload/v1764633789/mercana-products/nwlxn8e0zoa46igky7ka.jpg,$33.00,$79,38
Vahn Sculptural Cream Glazed Decorative Ceramic Bowl,Mercana,Decor,https://res.cloudinary.com/dnmufldqz/image/upload/v1764633791/mercana-products/ds9qkmuxtu1frwr2erav.jpg,$72.00,$189,27
Twyla Tall Cream Glazed Floor Ceramic Vase,Mercana,Decor,https://res.cloudinary.com/dnmufldqz/image/upload/v1764633793/mercana-products/glsror3gzmvq5rsxhvs6.jpg,$135.00,$359,130
Twyla Short Cream Glazed Floor Vase,Mercana,Decor,https://res.cloudinary.com/dnmufldqz/image/upload/v1764633794/mercana-products/dgcmiwtzpnnn3q81lyl5.jpg,$84.00,$199,103
Truett White w/ Blue Stripes Ceramic Jug Vase,Mercana,Decor,https://res.cloudinary.com/dnmufldqz/image/upload/v1764633795/mercana-products/tj69n48aig7v3p4xsaqc.jpg,$39.00,$99,87
Ulvi Cream Glazed Bubble Ceramic Vase,Mercana,Decor,https://res.cloudinary.com/dnmufldqz/image/upload/v1764633796/mercana-products/yc5vrp1pi4syjly3zxiv.jpg,$36.00,$89,99
Vanna Sculptural Cream Glazed Ceramic Vase,Mercana,Decor,https://res.cloudinary.com/dnmufldqz/image/upload/v1764633798/mercana-products/qxn1q7cle1bkq2jxsfya.jpg,$63.00,$159,42
Dylan Tall Textured Off White w/ Handles Ceramic Vase,Mercana,Decor,https://res.cloudinary.com/dnmufldqz/image/upload/v1764633799/mercana-products/e7zwjyzuru0m9phakicy.jpg,$45.00,$109,15
Mira Wide Textured Blush Beige Fluted Ceramic Vase,Mercana,Decor,https://res.cloudinary.com/dnmufldqz/image/upload/v1764633801/mercana-products/ihy0so4ptwad3femaoej.jpg,$51.00,$129,28
Darian Tall Textured Matte White Ceramic Vase,Mercana,Decor,https://res.cloudinary.com/dnmufldqz/image/upload/v1764633803/mercana-products/rlsrvqwikna6ciagwbrk.jpg,$21.00,$46,11
Dinah Large White w/ Black Stripes Ceramic Vase,Mercana,Decor,https://res.cloudinary.com/dnmufldqz/image/upload/v1764633804/mercana-products/i3a3dforhea4jom1t5p3.jpg,$66.00,$169,43
Dinah Small White w/ Black Stripes Ceramic Vase,Mercana,Decor,https://res.cloudinary.com/dnmufldqz/image/upload/v1764633806/mercana-products/ti0ez0hg0nvimg4adbad.jpg,$45.00,$109,30
Townley Tall White w/ Black Ombre Metal Vase,Mercana,Decor,https://res.cloudinary.com/dnmufldqz/image/upload/v1764633807/mercana-products/ra08o2ykhj4kmhplummj.jpg,$27.00,$59,42
Townley Small White w/ Black Ombre Metal Vase,Mercana,Decor,https://res.cloudinary.com/dnmufldqz/image/upload/v1764633808/mercana-products/mpppostiqqntztzllwsy.jpg,$24.00,$59,36
Tovah Tall Textured White w/ Gold Metal Vase,Mercana,Decor,https://res.cloudinary.com/dnmufldqz/image/upload/v1764633810/mercana-products/cvvbxpexaeqeqnobahbe.jpg,$27.00,$59,47
Tovah Medium Textured White w/ Gold Metal Vase,Mercana,Decor,https://res.cloudinary.com/dnmufldqz/image/upload/v1764633811/mercana-products/lppixnwd34bv2agqfgbf.jpg,$24.00,$59,39
Troian Large Rattan Wrapped Glass Bottle,Mercana,Decor,https://res.cloudinary.com/dnmufldqz/image/upload/v1764633814/mercana-products/fwzkf6gyonl6tlnbpi6a.jpg,$57.00,$159,43
Troian Medium Rattan Wrapped Glass Bottle,Mercana,Decor,https://res.cloudinary.com/dnmufldqz/image/upload/v1764633815/mercana-products/llkgagvcn2cfjln3ssm1.jpg,$30.00,$89,18
Thad 1-Light Natural Woven Rattan Dome Pendant,Mercana,Lighting,https://res.cloudinary.com/dnmufldqz/image/upload/v1764633816/mercana-products/x2jxf9ofxkwkej2zdk0r.jpg,$147.00,$449,10
Titus 1-Light Brass Finished Metal Disc Pendant,Mercana,Lighting,https://res.cloudinary.com/dnmufldqz/image/upload/v1764633818/mercana-products/q7yvle7tikavagkvxsls.jpg,$132.00,$439,36
Tori Gunmetal w/ Textured Metal Cross Frame Wall Mirror,Mercana,Decor,https://res.cloudinary.com/dnmufldqz/image/upload/v1764633819/mercana-products/hwhw29pl6toqu5nfczbh.jpg,$240.00,$639,18
Tillie Oblong Matte Black Metal Standing Floor Mirror,Mercana,Decor,https://res.cloudinary.com/dnmufldqz/image/upload/v1764633820/mercana-products/retb3tkkt0sphncfygxd.jpg,$234.00,$609,31
Tiffany Brushed Black Metal Double Frame Arched Mirror,Mercana,Decor,https://res.cloudinary.com/dnmufldqz/image/upload/v1764633821/mercana-products/ec8852zyrqtekars8isy.jpg,$147.00,$379,1
Tiva Rectangular Dual Brushed Gold Metal Framed Mirror,Mercana,Decor,https://res.cloudinary.com/dnmufldqz/image/upload/v1764633823/mercana-products/pkgdoa8gmce3qgqviace.jpg,$147.00,$359,58
Tabor Natural Wood w/ Black Oak Waterfall Media Coffee Table,Mercana,Furniture,https://res.cloudinary.com/dnmufldqz/image/upload/v1764633824/mercana-products/ver7lefiewv8thflu9uz.jpg,$870.00,"$1,609",5
Tabor Natural Wood w/ Black Oak Waterfall Console Table,Mercana,Furniture,https://res.cloudinary.com/dnmufldqz/image/upload/v1764633826/mercana-products/gjyqso2qkzjeezcbhguw.jpg,$468.00,"$1,089",8
Stratton Gunmetal w/ Genuine Brown Leather Upholstered Accent Chair,Mercana,Furniture,https://res.cloudinary.com/dnmufldqz/image/upload/v1764633828/mercana-products/xbrwtg7nwckgho21n4ic.jpg,$690.00,"$1,959",11
Stratton Gunmetal w/ Genuine Aged Black Leather Upholstered Accent Chair,Mercana,Furniture,https://res.cloudinary.com/dnmufldqz/image/upload/v1764633829/mercana-products/dvlrfu2mm4ogjgdyvff8.jpg,$690.00,"$1,999",6
"Teva Black Wood Rectangular 92"" Dining Table",Mercana,Furniture,https://res.cloudinary.com/dnmufldqz/image/upload/v1764633830/mercana-products/hi2mtvrhrmooydayk8ki.jpg,"$1,170.00","$2,899",9
Taylin Light Brown Wood Round Coffee Table,Mercana,Furniture,https://res.cloudinary.com/dnmufldqz/image/upload/v1764633832/mercana-products/kvcrsipnlf9fh9fwyj9z.jpg,$561.00,"$1,359",17
"Jennings 60"" Light Brown Wood Dining Table",Mercana,Furniture,https://res.cloudinary.com/dnmufldqz/image/upload/v1764633834/mercana-products/sxlo5fojnieurczghc2p.jpg,$504.00,"$1,559",13
Taimo White Washed Light Brown Wood w/ Striped Fabric Seat Bench,Mercana,Furniture,https://res.cloudinary.com/dnmufldqz/image/upload/v1764633835/mercana-products/zwcqrjv6dyofo9nfqunr.jpg,$210.00,$639,2
Taniel Textured Black Wood w/ Black Metal Stool,Mercana,Furniture,https://res.cloudinary.com/dnmufldqz/image/upload/v1764633836/mercana-products/ysxevvy9w53gw6jtnuw2.jpg,$108.00,$319,8
Taniel Light Brown Wood w/ Black Metal Stool,Mercana,Furniture,https://res.cloudinary.com/dnmufldqz/image/upload/v1764633838/mercana-products/dib3cewpyv8r0xpbkn2p.jpg,$108.00,$319,20
Sina Brown Oak Wood w/ Natural Rattan 2 Door Curio Cabinet,Mercana,Furniture,https://res.cloudinary.com/dnmufldqz/image/upload/v1764633839/mercana-products/lfpetdn1exk0n4vzwe2g.jpg,"$1,320.00","$3,499",3
Siren Gray Fabric w/ Dark Brown Wood Oblong Bench,Mercana,Furniture,https://res.cloudinary.com/dnmufldqz/image/upload/v1764633840/mercana-products/axhhaqpvpg66iy2bc2nv.jpg,$345.00,$889,5
Siren Gray Fabric w/ Dark Brown Wood Round Accent Stool,Mercana,Furniture,https://res.cloudinary.com/dnmufldqz/image/upload/v1764633842/mercana-products/ipn07a7lxcrdzuybufsz.jpg,$132.00,$299,1
Sohan Light Brown Elm Wood w/ Oatmeal Fabric Bench,Mercana,Furniture,https://res.cloudinary.com/dnmufldqz/image/upload/v1764633850/mercana-products/qt5mfwvakednrucwf3aa.jpg,$480.00,"$1,309",9
Shane Black Wood w/ Woven Black Leather Bench,Mercana,Furniture,https://res.cloudinary.com/dnmufldqz/image/upload/v1764633851/mercana-products/jraeokezlurqnvtofeqo.jpg,$453.00,"$1,409",35
Shane Brown Wood w/ Woven Brown Leather Bench,Mercana,Furniture,https://res.cloudinary.com/dnmufldqz/image/upload/v1764633855/mercana-products/zk0iwfhjjiqfghfgqmvt.jpg,$453.00,"$1,409",25
Shane Brown Wood w/ Woven Brown Leather Counter Stool,Mercana,Furniture,https://res.cloudinary.com/dnmufldqz/image/upload/v1764633856/mercana-products/iagrunus4vudy4pqpajd.jpg,$333.00,"$1,069",42
Sekou Light Brown Wooden Craftsman Console Table,Mercana,Furniture,https://res.cloudinary.com/dnmufldqz/image/upload/v1764633860/mercana-products/b5wxqztfeyt1o1lxhylf.jpg,$241.20,$699,10
Sekou Light Brown Wooden Craftsman Bench,Mercana,Furniture,https://res.cloudinary.com/dnmufldqz/image/upload/v1764633869/mercana-products/mbfewitg6fsdaepr6roi.jpg,$208.08,$649,10
Parker Muted Brown Faux Leather w/ Black Metal Counter Stool,Mercana,Furniture,https://res.cloudinary.com/dnmufldqz/image/upload/v1764633872/mercana-products/qkujnxviy1xon105oiek.jpg,$222.48,$639,1
Sekou Light Brown Short Wooden Craftsman Stool,Mercana,Furniture,https://res.cloudinary.com/dnmufldqz/image/upload/v1764633873/mercana-products/bk8i0bn8mfdhjpls4gc9.jpg,$107.28,$329,27
Saanvi Wool w/ Cream and Black Stitched Cross Patterned Pouf,Mercana,Decor,https://res.cloudinary.com/dnmufldqz/image/upload/v1764633874/mercana-products/ivfiohdago7gau9ewqsu.jpg,$63.00,$199,28
Samiya Jute w/ White Cotton Pouf,Mercana,Decor,https://res.cloudinary.com/dnmufldqz/image/upload/v1764633876/mercana-products/tejmctvpeveaw73tfz6l.jpg,$67.68,$229,30
Riri Wooden Bird Decorative Object,Mercana,Decor,https://res.cloudinary.com/dnmufldqz/image/upload/v1764633881/mercana-products/raqkdjpi9u5fw6xffkyu.jpg,$24.00,$69,6
Sadiyah Antiqued Gold Brushed Metal w/ Cream Shade Table Lamp,Mercana,Lighting,https://res.cloudinary.com/dnmufldqz/image/upload/v1764633887/mercana-products/sco8fvct2sp0tsg3ort8.jpg,$123.00,$379,15
Rollins Large Cream w/ Black Stripes Wool Framed Art,Mercana,Decor,https://res.cloudinary.com/dnmufldqz/image/upload/v1764633889/mercana-products/g1s3vd4ilpmo1ihggatt.jpg,$337.68,"$1,039",23
Nora Charcoal Fabric w/ Matte Black Metal Legs Accent Chair,Mercana,Decor,https://res.cloudinary.com/dnmufldqz/image/upload/v1764633890/mercana-products/onulkqmr2xwp6nsa7a4b.jpg,$280.08,$799,37
Rollins Small Cream w/ Black Stripes Wool Framed Art,Mercana,Decor,https://res.cloudinary.com/dnmufldqz/image/upload/v1764633891/mercana-products/ezhnaw5pak0nhq578xua.jpg,$190.80,$579,24
Revelin Small Fabric Collage Framed Linen Wall Art,Mercana,Decor,https://res.cloudinary.com/dnmufldqz/image/upload/v1764633893/mercana-products/zhwly5sllfhvhpus5rs3.jpg,$183.60,$559,17
Gabriel Large Matte Black Chandelier,Mercana,Lighting,https://res.cloudinary.com/dnmufldqz/image/upload/v1764633894/mercana-products/iynqrnuaexayvsza2q8z.jpg,$222.48,$559,2
Nora Forest Green Fabric w/ Matte Black Metal Legs Accent Chair,Mercana,Furniture,https://res.cloudinary.com/dnmufldqz/image/upload/v1764633895/mercana-products/gjrvrwqpbzprjzpipwwn.jpg,$280.08,$799,15
Nora Cream Fabric w/ Matte Black Metal Legs Accent Chair,Mercana,Furniture,https://res.cloudinary.com/dnmufldqz/image/upload/v1764633896/mercana-products/vkhacm4hqpcespwszbir.jpg,$280.08,$809,22
Darwin Light Brown Wooden 2 Door w/ 2 Shelves Accent Cabinet,Mercana,Furniture,https://res.cloudinary.com/dnmufldqz/image/upload/v1764633898/mercana-products/joxxaqykixmyabnx8n0y.jpg,$441.00,"$1,359",6
Grosjean Black Leather w/ Black Metal Frame Accent Chair,Mercana,Furniture,https://res.cloudinary.com/dnmufldqz/image/upload/v1764633900/mercana-products/ze8ro1qp1taaelvxmpcs.jpg,$870.00,"$2,299",6
Pia Matte Black w/ Brushed Gold Metal Taper Candleholder (Set of 2),Mercana,Decor,https://res.cloudinary.com/dnmufldqz/image/upload/v1764633901/mercana-products/cvkht5xhjox4ogjbyocl.jpg,$30.00,$79,15
Quade Small Gold Metal Planter,Mercana,Decor,https://res.cloudinary.com/dnmufldqz/image/upload/v1764633902/mercana-products/y96eybmy5duuuuw754ri.jpg,$30.00,$89,32
Piero Large Concrete Finished Metal Decorative Bowl,Mercana,Decor,https://res.cloudinary.com/dnmufldqz/image/upload/v1764633904/mercana-products/qxi4vvjoaysxzn78nnnx.jpg,$73.44,$219,18
Piero Small Concrete Finished Metal Decorative Bowl,Mercana,Decor,https://res.cloudinary.com/dnmufldqz/image/upload/v1764633905/mercana-products/rr9wtlf1rvirxka0dil1.jpg,$54.00,$159,24
Heera Light Brown Diamond Motif w/ Shelf Accent Cabinet,Mercana,Furniture,https://res.cloudinary.com/dnmufldqz/image/upload/v1764633907/mercana-products/cpkdisjfcvtx6vjcolb9.jpg,$435.00,"$1,249",3
Beth Light Brown Wood Square Accent Table,Mercana,Furniture,https://res.cloudinary.com/dnmufldqz/image/upload/v1764633909/mercana-products/ousjpozmvnhv3kyey1sn.jpg,$179.28,$529,15
Celeste Dark Brown Medium Arched Mirror,Mercana,Furniture,https://res.cloudinary.com/dnmufldqz/image/upload/v1764633910/mercana-products/x3o6uq8digvzbinwymyi.jpg,$207.00,$609,27
Randy Textured Silver Nickel Cast Aluminum Metal Accent Table,Mercana,Furniture,https://res.cloudinary.com/dnmufldqz/image/upload/v1764633912/mercana-products/yimgalbtmyvtuiem4awo.jpg,$140.40,$449,49
Raul Medium Brown Wood W/ Silver Metal Wall Clock,Mercana,Decor,https://res.cloudinary.com/dnmufldqz/image/upload/v1764633915/mercana-products/y2nsvejjvt4flrznpjvi.jpg,$102.00,$309,14
Ranela Light Brown Beaded Wooden Wall Mirror,Mercana,Decor,https://res.cloudinary.com/dnmufldqz/image/upload/v1764633917/mercana-products/oalfmxbynpvhwig8zwm8.jpg,$135.00,$379,18
Rios Gold and Red Painted w/ Acid Wash Metal Wall Art,Mercana,Decor,https://res.cloudinary.com/dnmufldqz/image/upload/v1764633919/mercana-products/j16fuxkyxruygaddlamq.jpg,$234.00,$659,3
Ramos Painted Antiqued Gold Metal Wall Art,Mercana,Decor,https://res.cloudinary.com/dnmufldqz/image/upload/v1764633921/mercana-products/cwj7svt2dhcgmdycbzix.jpg,$108.00,$329,9
Clapp Round Light Brown W/ White Wash Wood and Silver Metal Nesting Coffee Tables (Set of 2),Mercana,Furniture,https://res.cloudinary.com/dnmufldqz/image/upload/v1764633922/mercana-products/wc0q5yiwkoq8toouk9bs.jpg,$408.00,"$1,229",6
Quonset Extra Tall Brass Finished Aluminum Metal Pillar Object,Mercana,Decor,https://res.cloudinary.com/dnmufldqz/image/upload/v1764633924/mercana-products/q5gdmvmjhr0ijuxvdir8.jpg,$64.08,$189,51
Sam Counter Stool W/ Light Brown Wood Frame and Beige Upholstered Seat,Mercana,Furniture,https://res.cloudinary.com/dnmufldqz/image/upload/v1764633926/mercana-products/utvrxvsott0x2wapysdw.jpg,$265.68,$689,16
Ernest Medium Brown Wood Bar Stool,Mercana,Furniture,https://res.cloudinary.com/dnmufldqz/image/upload/v1764633928/mercana-products/ytggdwhv50xk7i8l4s6e.jpg,$154.76,$459,39
Etienne Light Brown Wood w/ Iron Metal Counter Stool,Mercana,Furniture,https://res.cloudinary.com/dnmufldqz/image/upload/v1764633929/mercana-products/hatgyq4r6n4fjcvxktwk.jpg,$172.08,$549,2
Etienne Light Brown Wood w/ Iron Metal Dining Chair,Mercana,Furniture,https://res.cloudinary.com/dnmufldqz/image/upload/v1764633931/mercana-products/h2pez2ui4s0a3xrhvcy1.jpg,$103.68,$329,4
Indie Medium Brown w/ Cane Counter Stool,Mercana,Furniture,https://res.cloudinary.com/dnmufldqz/image/upload/v1764633932/mercana-products/lmdoovifzc6tz5te1ngr.jpg,$337.68,$929,1
Indie Medium Brown Wood w/ Cane Bar Stool,Mercana,Furniture,https://res.cloudinary.com/dnmufldqz/image/upload/v1764633933/mercana-products/g26jeir8ylbyo3it13cw.jpg,$342.00,$949,3
Gianna Open Back Light Brown Wood w/ Oatmeal Fabric Accent Chair,Mercana,Furniture,https://res.cloudinary.com/dnmufldqz/image/upload/v1764633935/mercana-products/p56yhcryb04kwowrrz66.jpg,$600.00,"$1,599",18
Gianna Open Back Medium Brown Wood w/ Taupe Boucle Fabric Accent Chair,Mercana,Furniture,https://res.cloudinary.com/dnmufldqz/image/upload/v1764633938/mercana-products/iythsgf2x8b0nzdhpxte.jpg,$600.00,"$1,599",1
Medina Antiqued Black Tall Metal Planters (Set of 2),Mercana,Decor,https://res.cloudinary.com/dnmufldqz/image/upload/v1764633950/mercana-products/wt4wawsfln6r7fkooy6h.jpg,$60.48,$149,10
Medina Antiqued Black Metal Planters (Set of 2),Mercana,Decor,https://res.cloudinary.com/dnmufldqz/image/upload/v1764633952/mercana-products/ytbh0ton0spyuipw8m4f.jpg,$60.48,$149,33
Medina Off White w/ Gold Antiquing Metal Planters (Set of 2),Mercana,Decor,https://res.cloudinary.com/dnmufldqz/image/upload/v1764633954/mercana-products/gflifdszwaafzvryyt00.jpg,$60.48,$149,30
Tamuz Grass Baskets (Set of 2),Mercana,Decor,https://res.cloudinary.com/dnmufldqz/image/upload/v1764633968/mercana-products/mhaotmbgqe53yozxh0jo.jpg,$45.00,$119,41
Thala Medium Brown Round Wicker Tray (Set of 2),Mercana,Decor,https://res.cloudinary.com/dnmufldqz/image/upload/v1764633969/mercana-products/nxuaydx22kxysazinnbb.jpg,$69.00,$169,18
Thea Matte Black Wicker Trays (Set of 2),Mercana,Decor,https://res.cloudinary.com/dnmufldqz/image/upload/v1764633970/mercana-products/i0cuyelreeudnl4ytucy.jpg,$69.00,$169,38
Vivian Gold Metal and Glass Hurricane Candle Holder (Set of 2),Mercana,Decor,https://res.cloudinary.com/dnmufldqz/image/upload/v1764633971/mercana-products/kvfoanrs6mternxjvyk1.jpg,$39.00,$99,163
Verna Matte Black Wire Cage Metal Planters (Set of 2),Mercana,Decor,https://res.cloudinary.com/dnmufldqz/image/upload/v1764633973/mercana-products/qkbjjbq8wciwt7danrms.jpg,$103.68,$289,24
Ziva Large Distressed White Metal Sculptural Object,Mercana,Decor,https://res.cloudinary.com/dnmufldqz/image/upload/v1764633975/mercana-products/it6ne0npdelwrkveolb0.jpg,$24.00,$49,24
Ziva Small Distressed Wall White Metal Sculptural Object,Mercana,Decor,https://res.cloudinary.com/dnmufldqz/image/upload/v1764633976/mercana-products/pdci84xv3kj11rjxwwi0.jpg,$18.00,$43,23
Locke Large Gold Metal Decorative Object,Mercana,Decor,https://res.cloudinary.com/dnmufldqz/image/upload/v1764633977/mercana-products/o9idp0o3o6nrenamb8oz.jpg,$10.08,$24,66
Locke Small Matte Gold Metal Decorative Object,Mercana,Decor,https://res.cloudinary.com/dnmufldqz/image/upload/v1764633978/mercana-products/rbyqwvs1xmuybtvna7c1.jpg,$8.64,$19,70
